{
  "v": 7,
  "zr": "4.2.6",
  "save_id": "SAVE-2026-01-01T00:00:00Z-HQ-PROBE-001",
  "parent_save_id": null,
  "merge_id": null,
  "branch_id": "ANCHOR-main",
  "campaign": {
    "episode": 1,
    "mission": 0,
    "px": 0,
    "px_state": "stable",
    "heat": 0,
    "mode": "mixed",
    "epoch": null,
    "rift_seeds": [],
    "entry_choice_skipped": false,
    "episode_start": null,
    "episode_end": null
  },
  "characters": [
    {
      "id": "CHR-PROBE-001",
      "name": "Lena Voss",
      "callsign": "PROBE",
      "rank": "Rekrut",
      "lvl": 1,
      "xp": 0,
      "origin": {
        "epoch": "Europa, frühes 21. Jahrhundert",
        "hominin": "Homo sapiens sapiens",
        "role": "Ex-Industrieklettererin & Sicherheitstechnikerin"
      },
      "attr": {
        "STR": 2,
        "GES": 4,
        "INT": 4,
        "CHA": 3,
        "TEMP": 3,
        "SYS": 2
      },
      "lp": 10,
      "lp_max": 10,
      "stress": 0,
      "has_psi": false,
      "sys_installed": 0,
      "talents": [
        {
          "name": "Industrieklettern",
          "tier": "Basis",
          "type": "echo",
          "effect": "+2 auf Klettern/Abseilen/Höhenarbeitsproben. Routineabstiege: automatischer Erfolg."
        },
        {
          "name": "Schlösser & Sicherheitssysteme",
          "tier": "Basis",
          "type": "active",
          "effect": "+2 auf Proben zum Öffnen, Umgehen oder Analysieren mechanischer und elektronischer Sicherungen. Einfache Schlösser: automatischer Erfolg."
        },
        {
          "name": "Lagebewertung",
          "tier": "Basis",
          "type": "active",
          "effect": "+2 auf erste Wahrnehmungsprobe in neuem Raum/Gebiet. 1×/Szene: eine ehrliche Frage zur Umgebung."
        }
      ],
      "equipment": [
        {
          "name": "Comlink (Knochenleitung, Epoche-adaptiv)",
          "type": "gadget",
          "tier": 0
        },
        {
          "name": "Handscanner (EM/Wärme/Materialanalyse)",
          "type": "gadget",
          "tier": 1
        },
        {
          "name": "Beretta Compact",
          "type": "weapon",
          "tier": 1
        },
        {
          "name": "Taktische Leichtrüstung",
          "type": "armor",
          "tier": 1
        },
        {
          "name": "Werkzeugset Kompakt",
          "type": "gadget",
          "tier": 0
        }
      ],
      "implants": [],
      "history": {
        "background": "Ex-Industrieklettererin und Sicherheitstechnikerin aus Europa, frühes 21. Jh. Kennt gesperrte Orte von innen, bevor sie fragt ob sie darf. ITI-Rekrut, erste Einsatzsaison.",
        "milestones": []
      },
      "carry": [],
      "quarters_stash": [],
      "vehicles": {
        "epoch_vehicle": {
          "id": "VEH-PROBE-001",
          "name": "ITI-Standardfahrzeug",
          "type": "vehicle",
          "tier": 1,
          "upgrades": []
        },
        "availability": {
          "ready_every_missions": 3,
          "next_ready_in": 0
        },
        "legendary_temporal_ship": null
      },
      "reputation": {
        "iti": 0,
        "faction": "Ordo Mnemonika",
        "factions": {
          "ordo_mnemonika": 0,
          "chrono_symmetriker": 0,
          "kausalklingen": 0,
          "zerbrechliche_ewigkeit": 0
        }
      },
      "wallet": 100,
      "level_history": {}
    }
  ],
  "economy": {
    "wallets": {}
  },
  "research": {
    "projects": []
  },
  "logs": {
    "trace": [],
    "hud": [],
    "psi": [],
    "arena_psi": [],
    "market": [],
    "artifact_log": [],
    "notes": [],
    "flags": {
      "runtime_version": "4.2.6",
      "chronopolis_unlocked": false,
      "imported_saves": [],
      "duplicate_branch_detected": false,
      "duplicate_character_detected": false,
      "continuity_conflicts": []
    }
  },
  "summaries": {
    "summary_last_episode": "",
    "summary_last_rift": "",
    "summary_active_arcs": ""
  },
  "continuity": {
    "last_seen": {
      "mode": "hq",
      "episode": 1,
      "mission": 0,
      "location": "HQ"
    },
    "split": {
      "family_id": null,
      "thread_id": null,
      "expected_threads": [],
      "resolved_threads": [],
      "convergence_ready": false
    },
    "roster_echoes": [
      {
        "char_id": "NPC-GRAVEL-001",
        "tone": "ruhig, verlässlich",
        "text": "Viktor Marek, Callsign GRAVEL — Ex-tschechoslowakischer Grenzer, Jahrgang 1971. STR 5, Nahkampf-Spezialist. Redet wenig, hält Flanken."
      },
      {
        "char_id": "NPC-ECHO-001",
        "tone": "analytisch, leicht nervös unter Druck",
        "text": "Fatou Diallo, Callsign ECHO — Historikerin und Ex-Diplomatendolmetscherin, Dakar 2031. CHA 5, INT 4. Liest Räume und Menschen schnell."
      }
    ],
    "shared_echoes": [],
    "convergence_tags": [],
    "npc_roster": [
      {
        "id": "NPC-GRAVEL-001",
        "name": "Viktor Marek",
        "callsign": "GRAVEL",
        "role": "Nahkampf / Flanke",
        "scope": "crew",
        "status": "active",
        "lvl": 1,
        "lp": 12,
        "lp_max": 12,
        "attr": {
          "STR": 5,
          "GES": 3,
          "INT": 2,
          "CHA": 2,
          "TEMP": 3,
          "SYS": 3
        },
        "talents": [
          {
            "name": "Militärischer Nahkampf",
            "tier": "Basis",
            "effect": "+2 auf STR-Kampfproben."
          }
        ],
        "wallet": 0
      },
      {
        "id": "NPC-ECHO-001",
        "name": "Fatou Diallo",
        "callsign": "ECHO",
        "role": "Intel / Social Engineering",
        "scope": "crew",
        "status": "active",
        "lvl": 1,
        "lp": 9,
        "lp_max": 9,
        "attr": {
          "STR": 2,
          "GES": 3,
          "INT": 4,
          "CHA": 5,
          "TEMP": 2,
          "SYS": 2
        },
        "talents": [
          {
            "name": "Sprachanalyse & Soziale Kalibrierung",
            "tier": "Basis",
            "effect": "+2 auf CHA-Proben bei erstem Kontakt mit neuem NSC."
          }
        ],
        "wallet": 0
      }
    ],
    "active_npc_ids": [
      "NPC-GRAVEL-001",
      "NPC-ECHO-001"
    ]
  },
  "arc": {
    "factions": {},
    "questions": [],
    "hooks": []
  },
  "ui": {
    "gm_style": "verbose",
    "suggest_mode": false,
    "action_mode": "uncut",
    "intro_seen": true,
    "dice": {
      "debug_rolls": true
    },
    "contrast": "standard",
    "badge_density": "standard",
    "output_pace": "normal",
    "voice_profile": "gm_second_person"
  },
  "arena": {
    "active": false,
    "phase": "idle",
    "queue_state": "idle",
    "mode": "single",
    "tier": 1,
    "previous_mode": null,
    "resume_token": null,
    "contract_id": null,
    "streak": 0,
    "pending_rewards": {
      "cu": 0,
      "xp": 0,
      "arena_rep": 0,
      "multiplier": 1,
      "risk": "none"
    },
    "banked_rewards": {
      "cu": 0,
      "xp": 0,
      "arena_rep": 0
    },
    "rewarded_runs_this_contract": 0,
    "first_wins": {},
    "defeated_types": [],
    "last_reward_episode": null,
    "wins_player": 0,
    "wins_opponent": 0,
    "match_policy": "sim"
  }
}