{
  "v": 7,
  "zr": "4.2.6",
  "save_id": "SAVE-2026-CHARGEN-FADEN-001",
  "parent_save_id": null,
  "merge_id": null,
  "branch_id": "ANCHOR-main",
  "campaign": {
    "episode": 1,
    "mission": 0,
    "px": 0,
    "px_state": "stable",
    "heat": 0,
    "mode": "mixed",
    "epoch": null,
    "rift_seeds": [],
    "entry_choice_skipped": false,
    "episode_start": null,
    "episode_end": null
  },
  "characters": [
    {
      "id": "CHR-FADEN-001",
      "name": "Lena Vasek",
      "callsign": "FADEN",
      "rank": "Rekrut",
      "lvl": 1,
      "xp": 0,
      "origin": {
        "epoch": "1987, Prag",
        "hominin": "Homo sapiens sapiens",
        "role": "Analystin / Geheimdienstoperative"
      },
      "attr": {
        "STR": 2,
        "GES": 4,
        "INT": 4,
        "CHA": 5,
        "TEMP": 2,
        "SYS": 1
      },
      "lp": 10,
      "lp_max": 10,
      "stress": 0,
      "has_psi": false,
      "sys_installed": 0,
      "talents": [
        {
          "name": "Kaltleser",
          "stufe": "Basis",
          "effekt": "+2 auf CHA-Proben beim Einschätzen von Personen. Bei offensichtlichen NSC-Täuschungen automatischer Hinweis ohne Probe."
        }
      ],
      "equipment": [
        {
          "name": "Walther PPK",
          "type": "weapon",
          "tier": 1
        },
        {
          "name": "Aufnahmegerät (Mantelknopf-Mikro)",
          "type": "gadget",
          "tier": 0
        },
        {
          "name": "Gefälschte Diplomatenpapiere (2 Identitäten, 1960er)",
          "type": "gadget",
          "tier": 1
        },
        {
          "name": "ITI-Standardkomlink (Knochenleitung)",
          "type": "gadget",
          "tier": 1
        }
      ],
      "implants": [],
      "history": {
        "background": "Ehemalige StB-Analystin aus Prag, 1987. Fand eine Akte über eine Organisation, die Ereignisse vor ihrer eigenen Entstehung beeinflusst hatte. Zwei Wochen später vom ITI rekrutiert.",
        "milestones": []
      },
      "carry": [],
      "quarters_stash": [],
      "vehicles": {
        "epoch_vehicle": {
          "id": "VEH-FADEN-001",
          "name": "Nicht zugewiesen",
          "type": "vehicle",
          "tier": 1,
          "upgrades": []
        },
        "availability": {
          "ready_every_missions": 4,
          "next_ready_in": 0
        },
        "legendary_temporal_ship": null
      },
      "reputation": {
        "iti": 0,
        "faction": "Ordo Mnemonika",
        "factions": {
          "ordo_mnemonika": 0,
          "chrono_symmetriker": 0,
          "kausalklingen": 0,
          "zerbrechliche_ewigkeit": 0
        }
      },
      "wallet": 100,
      "level_history": {}
    }
  ],
  "economy": {
    "hq_pool": 0
  },
  "research": {
    "projects": []
  },
  "logs": {
    "trace": [],
    "hud": [],
    "psi": [],
    "arena_psi": [],
    "market": [],
    "artifact_log": [],
    "notes": [
      "Chargen abgeschlossen. Zero Time Lounge besucht. Barmann: Callsign unbekannt, Narbe Schulter links, erste Mission Nordafrika 1943. Agentin NAHT erwähnt: 3 Episoden, keine Verluste."
    ],
    "flags": {
      "runtime_version": "4.2.6",
      "chronopolis_unlocked": false,
      "imported_saves": [],
      "duplicate_branch_detected": false,
      "duplicate_character_detected": false,
      "continuity_conflicts": []
    }
  },
  "summaries": {
    "summary_last_episode": "",
    "summary_last_rift": "",
    "summary_active_arcs": ""
  },
  "continuity": {
    "last_seen": {
      "mode": "hq",
      "episode": 1,
      "mission": 0,
      "location": "HQ"
    },
    "split": {
      "family_id": null,
      "thread_id": null,
      "expected_threads": [],
      "resolved_threads": [],
      "convergence_ready": false
    },
    "roster_echoes": [],
    "shared_echoes": [],
    "convergence_tags": [],
    "npc_roster": [
      {
        "id": "NPC-MIRA-001",
        "name": "Mira",
        "callsign": "Archivarin",
        "role": "Duty-Desk / Neulingsbetreuung",
        "scope": "hq",
        "status": "aktiv"
      },
      {
        "id": "NPC-BARMANN-001",
        "name": "Unbekannt",
        "callsign": "Barmann",
        "role": "Zero Time Lounge",
        "scope": "hq",
        "status": "aktiv"
      },
      {
        "id": "NPC-NAHT-001",
        "name": "Unbekannt",
        "callsign": "NAHT",
        "role": "Erfahrene Agentin, 3 Episoden keine Verluste",
        "scope": "hq",
        "status": "aktiv"
      }
    ],
    "active_npc_ids": []
  },
  "arc": {
    "factions": {},
    "questions": [],
    "hooks": []
  },
  "ui": {
    "gm_style": "verbose",
    "suggest_mode": false,
    "action_mode": "uncut",
    "intro_seen": true,
    "dice": {
      "debug_rolls": true
    },
    "contrast": "standard",
    "badge_density": "standard",
    "output_pace": "normal",
    "voice_profile": "gm_second_person"
  },
  "arena": {
    "active": false,
    "phase": "idle",
    "queue_state": "idle",
    "mode": "single",
    "tier": 1,
    "previous_mode": null,
    "resume_token": null,
    "contract_id": null,
    "streak": 0,
    "pending_rewards": {
      "cu": 0,
      "xp": 0,
      "arena_rep": 0,
      "multiplier": 1,
      "risk": "none"
    },
    "banked_rewards": {
      "cu": 0,
      "xp": 0,
      "arena_rep": 0
    },
    "rewarded_runs_this_contract": 0,
    "first_wins": {},
    "defeated_types": [],
    "last_reward_episode": null,
    "wins_player": 0,
    "wins_opponent": 0,
    "match_policy": "sim"
  }
}