{
  "v": 7,
  "zr": "4.2.6",
  "save_id": "SAVE-2026-CHARGEN-VASEK-A01",
  "parent_save_id": null,
  "merge_id": null,
  "branch_id": "ANCHOR-main",
  "campaign": {
    "episode": 1,
    "mission": 0,
    "px": 0,
    "px_state": "stable",
    "heat": 0,
    "mode": "mixed",
    "epoch": null,
    "rift_seeds": [],
    "entry_choice_skipped": false,
    "episode_start": null,
    "episode_end": null
  },
  "characters": [
    {
      "id": "CHR-VASEK-A01",
      "name": "Lena Vasek",
      "callsign": "Spur",
      "rank": "Rekrutin",
      "lvl": 1,
      "xp": 0,
      "origin": {
        "epoch": "frühes 21. Jahrhundert",
        "hominin": "Homo sapiens sapiens",
        "role": "Forensische Archivarin"
      },
      "attr": {
        "STR": 2,
        "GES": 3,
        "INT": 5,
        "CHA": 4,
        "TEMP": 3,
        "SYS": 1
      },
      "lp": 10,
      "lp_max": 10,
      "stress": 0,
      "has_psi": false,
      "sys_installed": 0,
      "talents": [
        {
          "name": "Situationsanalyse",
          "tier": "Basis",
          "effect": "+2 auf INT-Proben zur Lageeinschätzung, Spurenanalyse und Risikoerkennung nach mindestens einer Runde Beobachtung. Triviale Beobachtungen gelingen automatisch."
        }
      ],
      "equipment": [
        {
          "name": "Beretta Compact",
          "type": "weapon",
          "tier": 0
        },
        {
          "name": "Stadtjacke mit Einlage",
          "type": "armor",
          "tier": 0
        },
        {
          "name": "ITI-Feldkit",
          "type": "gadget",
          "tier": 0
        },
        {
          "name": "Notizbuch + Kamera",
          "type": "gadget",
          "tier": 0
        }
      ],
      "implants": [],
      "history": {
        "background": "Vasek katalogisierte historische Gebäude vor dem Abriss. In einem leerstehenden Industriekomplex am Stadtrand photographierte sie Überreste eines Zeitrisses, die physikalisch nicht ins Gebäude gehörten. Das ITI hatte die Anomalie bereits markiert — Vasek war früher da. Sie wollte nicht rekrutiert werden. Aber sie konnte die Frage nicht loslassen.",
        "milestones": []
      },
      "carry": [
        {
          "name": "Beretta Compact",
          "type": "weapon",
          "tier": 0
        },
        {
          "name": "Stadtjacke mit Einlage",
          "type": "armor",
          "tier": 0
        },
        {
          "name": "ITI-Feldkit",
          "type": "gadget",
          "tier": 0
        },
        {
          "name": "Notizbuch + Kamera",
          "type": "gadget",
          "tier": 0
        }
      ],
      "quarters_stash": [],
      "vehicles": {
        "epoch_vehicle": {
          "id": "VEH-VASEK-01",
          "name": "ITI-Standardfahrzeug",
          "type": "vehicle",
          "tier": 1,
          "upgrades": []
        },
        "availability": {
          "ready_every_missions": 3,
          "next_ready_in": 0
        },
        "legendary_temporal_ship": null
      },
      "reputation": {
        "iti": 0,
        "faction": "Ordo Mnemonika",
        "factions": {
          "ordo_mnemonika": 0,
          "chrono_symmetriker": 0,
          "kausalklingen": 0,
          "zerbrechliche_ewigkeit": 0
        }
      },
      "wallet": 100,
      "level_history": {}
    }
  ],
  "economy": {
    "wallets": {
      "CHR-VASEK-A01": {
        "balance": 100
      }
    }
  },
  "research": {
    "projects": []
  },
  "logs": {
    "trace": [],
    "hud": [],
    "psi": [],
    "arena_psi": [],
    "market": [],
    "artifact_log": [],
    "notes": [
      {
        "tag": "chargen-note-vasek",
        "text": "Chargen abgeschlossen. Testfigur A01. Gefunden, nicht rekrutiert. Analytisch. Konsequenzen-empfindlich."
      }
    ],
    "flags": {
      "runtime_version": "4.2.6",
      "chronopolis_unlocked": false,
      "imported_saves": [],
      "duplicate_branch_detected": false,
      "duplicate_character_detected": false,
      "continuity_conflicts": []
    }
  },
  "summaries": {
    "summary_last_episode": "",
    "summary_last_rift": "",
    "summary_active_arcs": ""
  },
  "continuity": {
    "last_seen": {
      "mode": "hq",
      "episode": 1,
      "mission": 0,
      "location": "HQ"
    },
    "split": {
      "family_id": null,
      "thread_id": null,
      "expected_threads": [],
      "resolved_threads": [],
      "convergence_ready": false
    },
    "roster_echoes": [],
    "shared_echoes": [],
    "convergence_tags": [],
    "npc_roster": [],
    "active_npc_ids": []
  },
  "arc": {
    "factions": {},
    "questions": [],
    "hooks": []
  },
  "ui": {
    "gm_style": "verbose",
    "suggest_mode": false,
    "action_mode": "uncut",
    "intro_seen": true,
    "dice": {
      "debug_rolls": true
    },
    "contrast": "standard",
    "badge_density": "standard",
    "output_pace": "normal",
    "voice_profile": "gm_second_person"
  },
  "arena": {
    "active": false,
    "phase": "idle",
    "queue_state": "idle",
    "mode": "single",
    "tier": 1,
    "previous_mode": null,
    "resume_token": null,
    "contract_id": null,
    "streak": 0,
    "pending_rewards": {
      "cu": 0,
      "xp": 0,
      "arena_rep": 0,
      "multiplier": 1,
      "risk": "none"
    },
    "banked_rewards": {
      "cu": 0,
      "xp": 0,
      "arena_rep": 0
    },
    "rewarded_runs_this_contract": 0,
    "first_wins": {},
    "defeated_types": [],
    "last_reward_episode": null,
    "wins_player": 0,
    "wins_opponent": 0,
    "match_policy": "sim"
  }
}