{
  "v": 7,
  "zr": "4.2.6",
  "save_id": "SAVE-2026-CHARGEN-VERA-SOREL",
  "parent_save_id": null,
  "merge_id": null,
  "branch_id": "ANCHOR-main",
  "campaign": {
    "episode": 1,
    "mission": 0,
    "px": 0,
    "px_state": "stable",
    "heat": 0,
    "mode": "mixed",
    "epoch": null,
    "rift_seeds": [],
    "entry_choice_skipped": false,
    "episode_start": null,
    "episode_end": null
  },
  "characters": [
    {
      "id": "CHR-SOREL-01",
      "name": "Vera Sorel",
      "callsign": "SABLE",
      "rank": "Rekrut",
      "lvl": 1,
      "xp": 0,
      "origin": {
        "epoch": "Gegenwart",
        "hominin": "Homo sapiens sapiens",
        "role": "Forensikerin"
      },
      "attr": {
        "STR": 2,
        "GES": 4,
        "INT": 6,
        "CHA": 3,
        "TEMP": 2,
        "SYS": 1
      },
      "lp": 10,
      "lp_max": 10,
      "stress": 0,
      "has_psi": false,
      "sys_installed": 0,
      "talents": [
        {
          "name": "Tatortanalyse",
          "tier": "Basis",
          "effect": "+2 auf INT-Proben bei Spurensicherung/Tatortlesen. Triviale Analyse automatisch erfolgreich."
        },
        {
          "name": "Ruhige Hand",
          "tier": "Basis",
          "effect": "+2 auf GES-Proben unter Druck (Schuss, Schloss, Nahkampf-Finesse)."
        }
      ],
      "equipment": [
        {
          "name": "Beretta 92F",
          "type": "weapon",
          "tier": 1
        },
        {
          "name": "Kevlar-Weste leicht",
          "type": "armor",
          "tier": 1
        },
        {
          "name": "Forensik-Kit",
          "type": "gadget",
          "tier": 1
        },
        {
          "name": "Comlink-Ohrknopf",
          "type": "gadget",
          "tier": 0
        }
      ],
      "implants": [],
      "history": {
        "background": "Forensikerin bei Interpol, zwölf Jahre Tatortanalyse. In Lyon auf zeitlich unmögliche Spuren gestoßen — ITI wurde auf sie aufmerksam. Rekrutierung folgte.",
        "milestones": []
      },
      "carry": [],
      "quarters_stash": [],
      "vehicles": {
        "epoch_vehicle": {
          "id": "VEH-SOREL-01",
          "name": "Standard-Feldfahrzeug",
          "type": "vehicle",
          "tier": 1,
          "upgrades": []
        },
        "availability": {
          "ready_every_missions": 3,
          "next_ready_in": 0
        },
        "legendary_temporal_ship": null
      },
      "reputation": {
        "iti": 0,
        "faction": "Mischpool",
        "factions": {
          "ordo_mnemonika": 0,
          "chrono_symmetriker": 0,
          "kausalklingen": 0,
          "zerbrechliche_ewigkeit": 0
        }
      },
      "wallet": 100,
      "level_history": {}
    }
  ],
  "economy": {
    "hq_pool": 0
  },
  "research": {
    "projects": []
  },
  "logs": {
    "trace": [],
    "hud": [],
    "psi": [],
    "arena_psi": [],
    "market": [],
    "artifact_log": [],
    "notes": [
      "Chargen-Beat: Vera Sorel trifft Agent Dax in der Zero Time Lounge. Sein Partner Marcus Venn ging in Wien 1962 beim Exfil verloren — gilt als temporär verschollen. Erster Rat von Dax: Rücksprung ist heilig."
    ],
    "flags": {
      "runtime_version": "4.2.6",
      "chronopolis_unlocked": false,
      "imported_saves": [],
      "duplicate_branch_detected": false,
      "duplicate_character_detected": false,
      "continuity_conflicts": []
    }
  },
  "summaries": {
    "summary_last_episode": "",
    "summary_last_rift": "",
    "summary_active_arcs": ""
  },
  "continuity": {
    "last_seen": {
      "mode": "hq",
      "episode": 1,
      "mission": 0,
      "location": "HQ"
    },
    "split": {
      "family_id": null,
      "thread_id": null,
      "expected_threads": [],
      "resolved_threads": [],
      "convergence_ready": false
    },
    "roster_echoes": [],
    "shared_echoes": [],
    "convergence_tags": [],
    "npc_roster": [
      {
        "id": "NPC-DAX-01",
        "name": "Dax",
        "callsign": null,
        "role": "Agent, Mischpool, 3 Episoden",
        "scope": "hq",
        "status": "aktiv",
        "note": "Traf Vera in der Zero Time Lounge. Verlor Partner Marcus Venn in Wien 1962 beim Exfil."
      }
    ],
    "active_npc_ids": []
  },
  "arc": {
    "factions": {},
    "questions": [],
    "hooks": [
      "Marcus Venn — Dax' verschollener Partner, irgendwo in Wien 1962. Kein Auftrag, aber ein offener Faden."
    ]
  },
  "ui": {
    "gm_style": "verbose",
    "suggest_mode": false,
    "action_mode": "uncut",
    "intro_seen": true,
    "dice": {
      "debug_rolls": true
    },
    "contrast": "standard",
    "badge_density": "standard",
    "output_pace": "normal",
    "voice_profile": "gm_second_person"
  },
  "arena": {
    "active": false,
    "phase": "idle",
    "queue_state": "idle",
    "mode": "single",
    "tier": 1,
    "previous_mode": null,
    "resume_token": null,
    "contract_id": null,
    "streak": 0,
    "pending_rewards": {
      "cu": 0,
      "xp": 0,
      "arena_rep": 0,
      "multiplier": 1,
      "risk": "none"
    },
    "banked_rewards": {
      "cu": 0,
      "xp": 0,
      "arena_rep": 0
    },
    "rewarded_runs_this_contract": 0,
    "first_wins": {},
    "defeated_types": [],
    "last_reward_episode": null,
    "wins_player": 0,
    "wins_opponent": 0,
    "match_policy": "sim"
  }
}